{"$schema":"http://json-schema.org/draft-07/schema#","definitions":{"endpoint":{"properties":{"description":{"type":"string"},"notes":{"type":"string"},"path":{"type":"string"},"records":{"minimum":0,"type":"integer"},"schema":{"type":"string"},"updated":{"type":"string"}},"required":["path","description","schema","updated","records"],"type":"object"}},"description":"Self-describing manifest of every API endpoint: description, schema URL, updated timestamp, record counts, deprecation notes.","properties":{"documents":{"patternProperties":{"^.+$":{"type":"string"}},"type":"object"},"endpoints":{"patternProperties":{"^[a-z0-9-]+$":{"$ref":"#/definitions/endpoint"}},"type":"object"},"for_agents":{"type":"string"},"meta":{"properties":{"auth":{"type":"string"},"base":{"type":"string"},"generated":{"type":"string"},"version":{"type":"string"}},"required":["version","generated","base","auth"],"type":"object"},"name":{"type":"string"},"observed":{"type":"string"},"provenance":{"type":"string"},"repository":{"type":"string"},"skills":{"properties":{"count":{"minimum":0,"type":"integer"},"note":{"type":"string"},"registry":{"type":"string"}},"required":["registry","count"],"type":"object"},"version":{"type":"string"}},"required":["name","version","observed","meta","repository","for_agents","provenance","skills","endpoints","documents"],"title":"APIManifest","type":"object"}