{
 "name": "Aster da Master API",
 "version": "0.13.0",
 "observed": "2026-10-11",
 "meta": {
  "version": "0.13.0",
  "generated": "2026-10-11T00:00:00Z",
  "base": "api/v1/",
  "auth": "none - static files; no keys, no rate limits"
 },
 "repository": "https://github.com/astercast/aster-da-master",
 "for_agents": "Start at api/v1/index.json. The artist record is the source of truth; data/artist.json feeds the site renderer.",
 "provenance": "All artist facts verified against public platform pages (Apple Music, iHeart, Anghami, Shazam, Boomplay, SonicHits, album.link, SoundCloud). v0.5.0: the official SoundCloud profile (asterdamaster) catalog is fully verified — 185 SoundCloud-only tracks (upload dates + play-count snapshot) alongside the 34 distributor releases (219 total). Spotify is artist-linked via the official SoundCloud bio; Instagram + official site likewise bio-linked. 'Litemode Trilogy' is teased in the bio, not confirmed. v0.7.0: global-search slug index + on-this-day (MM-DD) API; homepage gains search overlay, on-this-day section, era intelligence deep-dives, and cast-lots. v0.7.1: year-in-review archive (years/2018-2026.html + api/v1/years.json), methodology page, Litemode Trilogy watch page. v0.9.0: milestones endpoint (career firsts computed from the verified discography); API playground + transmission decoder pages. v0.10.0: upload-sessions endpoint (61 sessions clustered from vault upload dates). Changelog endpoint (site construction history from git log). First-and-last endpoint (per-year opening/closing transmissions). v0.11.0: milestone-watch endpoint (vault tracks near round-number play counts).",
 "skills": {
  "registry": "skills/index.json",
  "count": 12,
  "note": "Hand-maintained markdown playbooks; not generated by scripts/build_*.py."
 },
 "endpoints": {
  "index": {
   "path": "api/v1/index.json",
   "description": "Manifest: every endpoint with description, schema URL, updated timestamp, record counts, and deprecation notes. Start here.",
   "schema": "api/v1/schema/index.json",
   "updated": "2026-10-11T00:00:00Z",
   "records": 18,
   "notes": "meta.version mirrors the top-level version field."
  },
  "artist": {
   "path": "api/v1/artist.json",
   "description": "The source of truth: artist record - bio, facts, discography (219 entries), platforms, eras, vault, upcoming. data/artist.json feeds the site renderer and mirrors it.",
   "schema": "api/v1/schema/artist.json",
   "updated": "2026-10-11T00:00:00Z",
   "records": 219,
   "notes": ""
  },
  "codex": {
   "path": "api/v1/codex.json",
   "description": "The vocabulary codex: 16 word families with per-family track lists.",
   "schema": "api/v1/schema/codex.json",
   "updated": "2026-10-11T00:00:00Z",
   "records": 16,
   "notes": ""
  },
  "release-slugs": {
   "path": "api/v1/release-slugs.json",
   "description": "Slug index for the generated release pages: ordinal string -> slug.",
   "schema": "api/v1/schema/release-slugs.json",
   "updated": "2026-10-11T00:00:00Z",
   "records": 219,
   "notes": ""
  },
  "on-this-day": {
   "path": "api/v1/on-this-day.json",
   "description": "Calendar index: transmissions keyed by MM-DD upload date.",
   "schema": "api/v1/schema/on-this-day.json",
   "updated": "2026-10-11T00:00:00Z",
   "records": 96,
   "notes": ""
  },
  "years": {
   "path": "api/v1/years.json",
   "description": "Year-in-review archive: per-year stats and highlights, 2018-2026.",
   "schema": "api/v1/schema/years.json",
   "updated": "2026-10-11T00:00:00Z",
   "records": 9,
   "notes": ""
  },
  "circle": {
   "path": "api/v1/circle.json",
   "description": "The collaborators: 21 voices parsed from title credits.",
   "schema": "api/v1/schema/circle.json",
   "updated": "2026-10-11T00:00:00Z",
   "records": 21,
   "notes": "Title-credit only; producers live in scene-figures.json."
  },
  "milestones": {
   "path": "api/v1/milestones.json",
   "description": "Career firsts computed from the verified discography: firsts, records, silences.",
   "schema": "api/v1/schema/milestones.json",
   "updated": "2026-10-11T00:00:00Z",
   "records": 9,
   "notes": ""
  },
  "sessions": {
   "path": "api/v1/sessions.json",
   "description": "Upload sessions: 61 studio sessions clustered from vault upload dates (7-day gap rule).",
   "schema": "api/v1/schema/sessions.json",
   "updated": "2026-10-11T00:00:00Z",
   "records": 61,
   "notes": "Computed clusters, not artist-named studio sessions."
  },
  "changelog": {
   "path": "api/v1/changelog.json",
   "description": "Site construction history, generated from the git log.",
   "schema": "api/v1/schema/changelog.json",
   "updated": "2026-10-11T00:00:00Z",
   "records": 48,
   "notes": "A changelog built from git log cannot record its own sync commit (wave-15 convention, WAVELOG.md)."
  },
  "first-last": {
   "path": "api/v1/first-last.json",
   "description": "Per year 2018-2026: the opening and closing transmissions.",
   "schema": "api/v1/schema/first-last.json",
   "updated": "2026-10-11T00:00:00Z",
   "records": 9,
   "notes": ""
  },
  "milestone-watch": {
   "path": "api/v1/milestone-watch.json",
   "description": "Milestone watch: vault tracks near round-number play counts.",
   "schema": "api/v1/schema/milestone-watch.json",
   "updated": "2026-10-11T00:00:00Z",
   "records": 3,
   "notes": "Play counts are a 2026-10-11 snapshot; they drift."
  },
  "scene-figures": {
   "path": "api/v1/scene-figures.json",
   "description": "Scene figures: producer credits and scene research outside the 21 (e.g. Fish Narc).",
   "schema": "api/v1/schema/scene-figures.json",
   "updated": "2026-10-11T00:00:00Z",
   "records": 1,
   "notes": ""
  },
  "transmission": {
   "path": "api/v1/transmission.json",
   "description": "The guided journey: six eras with stats, top tracks, key sessions, collaborators, milestones, and computed signal lines.",
   "schema": "api/v1/schema/transmission.json",
   "updated": "2026-10-11T00:00:00Z",
   "records": 6,
   "notes": ""
  },
  "network": {
   "path": "api/v1/network.json",
   "description": "Collaboration network: artist-centered nodes (21 title-credited collaborators + producer scene figures), track-weighted edges, co-credit links, computed insights.",
   "schema": "api/v1/schema/network.json",
   "updated": "2026-10-11T00:00:00Z",
   "records": 23,
   "notes": "23 nodes / 27 edges; no producer-collaborator edges exist on record."
  },
  "eras": {
   "path": "api/v1/eras.json",
   "description": "Era deep-dives: six eras with full transmission lists (every track + plays), ALL in-era collaborators, active codex families, milestones, computed signal lines and summaries. Data source for the eras/<id>.html deep-dive pages.",
   "schema": "api/v1/schema/eras.json",
   "updated": "2026-10-11T00:00:00Z",
   "records": 6,
   "notes": "collaborators[] holds every in-era voice; transmission.json keeps only the top 3."
  },
  "session-clusters": {
   "path": "api/v1/session-clusters.json",
   "description": "Session archaeology, interactive: the 61 upload sessions as an explorable timeline - per-session enrichment (era, loudest + deepest-cut tracks, title-credited collaborators, deep-dive/era/journey cross-links), the 60 inter-session gaps, activity seasons, and asserted insights. Data source for sessions-explorer.html.",
   "schema": "api/v1/schema/session-clusters.json",
   "updated": "2026-10-11T00:00:00Z",
   "records": 9,
   "notes": "Seasons are a computed browsing convention (silence > 90 days opens a new season), not artist-named eras."
  },
  "codex-families": {
   "path": "api/v1/codex-families.json",
   "description": "Codex family deep-dives: the 16 vocabulary families with decoded readings (traced verbatim to codex.json epithets; unknown where the archive assigns no meaning), era-by-era evolution, key sessions, and title-credited collaborators. Data source for the codex/<slug>.html deep-dive pages.",
   "schema": "api/v1/schema/codex-families.json",
   "updated": "2026-10-11T00:00:00Z",
   "records": 16,
   "notes": ""
  }
 },
 "documents": {
  "AGENT.md": "Agent operator's manual: base URL pattern, key endpoints with example requests, end-to-end workflows, rate/expectation notes.",
  "agents.html": "Human + agent surface: 18-endpoint table, llms files, skills, search-index usage, rates & expectations, worked workflows.",
  "API.md": "Human-readable API reference incl. the shared cross-site conventions block.",
  "llms.txt": "Short agent brief: catalog shape, method, API map, key verified facts, ops.",
  "llms-full.txt": "Full agent brief: per-era detail, collaborator research notes, unknowns register, page map, generator order."
 }
}
